{
  "artifacts": [
    {
      "path": "reports/adaptation_approval_ledger.json",
      "sha256": "8e05e885ed1e26aa4deac22c6b09490ac71758a86a954affd6cede9b86a82a23",
      "size": 1734
    },
    {
      "path": "reports/adaptation_proposals.json",
      "sha256": "8d17707454a407e544646e2b63df4a4cfac91f3f85941a6d6f34a0ac4d8e3c97",
      "size": 8885
    },
    {
      "path": "reports/adaptation_proposals.md",
      "sha256": "0e75ce6615213c1a95648d68a6c271ce056cdcbcb899bf3b102c9e8de6d361d2",
      "size": 4950
    },
    {
      "path": "reports/adaptation_regression_report.json",
      "sha256": "5952c157dc5b6e53dc1c98b6a2c7ed93affbab4ef3b7c4b1e412208d3dfb6295",
      "size": 2453
    },
    {
      "path": "reports/adaptation_regression_report.md",
      "sha256": "611714aed9cd37bff3aa49b755a01735ed553cf9d2b3f7fe20ca65893874d587",
      "size": 282
    },
    {
      "path": "reports/adoption_drift_report.json",
      "sha256": "de6bb56b2e300560de5b2994ae55af263aaceee748d0fd9064583649f2e9653c",
      "size": 1473
    },
    {
      "path": "reports/adoption_drift_report.md",
      "sha256": "85326515e54955601fd81c009174b5534c28e963b7e3a93da5ec050b7d3d1043",
      "size": 1075
    },
    {
      "path": "reports/architecture_maintainability.json",
      "sha256": "2966cc98e42450551a04cce0e73a181bf8845452646b3bb316ba5809b90c1a50",
      "size": 6526
    },
    {
      "path": "reports/architecture_maintainability.md",
      "sha256": "e24e0257a1014d8e6f0f4a50fdc5051ccc149bfef73c37ed6616ff8837150f18",
      "size": 3204
    },
    {
      "path": "reports/artifact-design-profile.json",
      "sha256": "21651dc80bd4f6b1372bc0fadd6a8615c6882388e52bd39ce51fbcf33a4fbe4a",
      "size": 4596
    },
    {
      "path": "reports/artifact-design-profile.md",
      "sha256": "a908e315eaadc970a6c67eb1900df93742000b20923f647c41aabf44bc52353c",
      "size": 3664
    },
    {
      "path": "reports/baseline-compare.json",
      "sha256": "2393f48d71e254d079bac54dce21341ca5309095a82a7059abe1433ce9190ef9",
      "size": 2603
    },
    {
      "path": "reports/baseline-compare.md",
      "sha256": "f870790195603ae72e75b3ea20f73f9847a2a8bda700dc6884c842144eedaa6d",
      "size": 530
    },
    {
      "path": "reports/benchmark_methodology.md",
      "sha256": "57025e0123ce5d10401c5bff376d2eeeac7943c83897ae1ad3fb22cadf790f92",
      "size": 2715
    },
    {
      "path": "reports/benchmark_reproducibility.json",
      "sha256": "6255aab07b2de4f48bf4ad47f407dfc1f9cbf1b9c35c9214b7117790e245d106",
      "size": 18051
    },
    {
      "path": "reports/benchmark_reproducibility.md",
      "sha256": "387fdd63214aeb84e3d1a3f95721cf8fb94901be24a4c540dfb0655f8a6cc930",
      "size": 9939
    },
    {
      "path": "reports/blind-human-review-2026-06-29/DO_NOT_OPEN_answer_key.html",
      "sha256": "c067c47b7722bef34aae192f27b39df05aa6db155c835ee8aba9369ede405c97",
      "size": 4591
    },
    {
      "path": "reports/blind-human-review-2026-06-29/DO_NOT_OPEN_answer_key.json",
      "sha256": "e58e7491aa86fa2d640823a4426f5aa59d4eb8d9d97366efbaae77bee48d9bc4",
      "size": 2368
    },
    {
      "path": "reports/blind-human-review-2026-06-29/README.md",
      "sha256": "06d6482dc7de5aff588bd3d8517eba486ec73412cf86feeeea5af39c56a76260",
      "size": 878
    },
    {
      "path": "reports/blind-human-review-2026-06-29/adjudication.md",
      "sha256": "65eb021992b9b1bec28af5371d5c989c508e4728816dec68c0d1a6b9b9fad5f5",
      "size": 1292
    },
    {
      "path": "reports/blind-human-review-2026-06-29/blind-pack.json",
      "sha256": "29521e0bbdc6c49a714744b2bded9a22f00dc1591008b4731501fac613b3e9cb",
      "size": 27705
    },
    {
      "path": "reports/blind-human-review-2026-06-29/case-01-support-triage.html",
      "sha256": "3451de51f19649717bdcd3f293c32814fe9f2ff31309b2a318163dfa458626a5",
      "size": 13653
    },
    {
      "path": "reports/blind-human-review-2026-06-29/case-02-monthly-revenue-reconciliation.html",
      "sha256": "c5f4e3b03434b10f21e37c16d57897bfadd5e4c4a00f8c04d978347c6da63cc4",
      "size": 12791
    },
    {
      "path": "reports/blind-human-review-2026-06-29/case-03-webinar-repurposing.html",
      "sha256": "e5c1dab1f84a748515b794c75881b5e79fdfc123535fffa216b87a5cbe26d352",
      "size": 12429
    },
    {
      "path": "reports/blind-human-review-2026-06-29/case-04-incident-postmortem.html",
      "sha256": "19fe9ef383a829550c487fa7a96858d18ae719fe78356b455ab808a4a707d605",
      "size": 12494
    },
    {
      "path": "reports/blind-human-review-2026-06-29/case-05-pr-review-followup.html",
      "sha256": "f443a03ee77843a8260e6c998df58783ed29fea82badf24a59060b09aa0b8200",
      "size": 11970
    },
    {
      "path": "reports/blind-human-review-2026-06-29/generate_pack.py",
      "sha256": "6e29f97bc18a9e7567e697f23c464da6ad97587be16cb44263de84f11ade8b3f",
      "size": 44093
    },
    {
      "path": "reports/blind-human-review-2026-06-29/index.html",
      "sha256": "c3edfca4d4b9d6afd568a81de137f0cf42f1c7a5f718834c4f5faf2ef7ad4f12",
      "size": 7519
    },
    {
      "path": "reports/blind-human-review-2026-06-29/review-decisions-template.json",
      "sha256": "def7b339107a5d17289112c1f663aae7808399f4dda7f882d47dc23c47f5eeaa",
      "size": 936
    },
    {
      "path": "reports/blind-human-review-2026-06-29/review-decisions.recorded.json",
      "sha256": "c45c70e94987f1a7eb2089b795b1b77adbd140a378d0ce0e217ff7299b84f96d",
      "size": 1913
    },
    {
      "path": "reports/candidate_registry.json",
      "sha256": "e8fd98a88bb4ccf7f6b70066387bbe06e8df125e545b00271cba45f10e0a8210",
      "size": 29923
    },
    {
      "path": "reports/candidate_registry.md",
      "sha256": "586e455366403cde841211212f3e0bedf8fa824199e21ba237ff20d73948d8d6",
      "size": 2263
    },
    {
      "path": "reports/compiled_targets.json",
      "sha256": "1bd9614385c113c765b5bf7566c8de50f0201c719c6c7a17bfc0bedcd41957ba",
      "size": 232646
    },
    {
      "path": "reports/compiled_targets.md",
      "sha256": "efe3d1d1835aa7ad64ba8bdbe630f6ea357fbb8c4109ea47020574e1b8d39352",
      "size": 4323
    },
    {
      "path": "reports/conformance_matrix.json",
      "sha256": "de8093861e687f979e8dc8328fd8a4872f19d0e92790d73b189660729b9dd777",
      "size": 10615
    },
    {
      "path": "reports/conformance_matrix.md",
      "sha256": "98b832a9078c911cc4e903e2af4ec14f3226ff83f01d96d00872a63cf0b9efdd",
      "size": 930
    },
    {
      "path": "reports/context_budget.json",
      "sha256": "7910bad6292ced47d3d08466e8722c9808c19cfe62e8f2b91eed9d2daabba35a",
      "size": 2045
    },
    {
      "path": "reports/context_budget.md",
      "sha256": "c492706bfa8fa36eb1f0080a7ada9b15b6a6bd179947c6654513d9af06e7de5c",
      "size": 769
    },
    {
      "path": "reports/context_budget_summary.json",
      "sha256": "dd2a8a4908908d183ef0a38e33809f5a3d9f21e371511d15c942ce7a21e72ffd",
      "size": 2939
    },
    {
      "path": "reports/description_drift_history.md",
      "sha256": "fb7b75025aeb6fe67dc87a7792b4fba4618872805ba16972ad4608959b2c7e70",
      "size": 5056
    },
    {
      "path": "reports/description_optimization.json",
      "sha256": "1024945444ce9b9460f66fa3634cc694420bb0931a090d64970b08cdd13e0629",
      "size": 330906
    },
    {
      "path": "reports/description_optimization.md",
      "sha256": "a3ff3515329086efe7e70ff201ea141bca56d215f54c95cf4c0c9c02e3126af3",
      "size": 2383
    },
    {
      "path": "reports/description_optimization_suite.json",
      "sha256": "06370d4ee82c7f4c6e3fb0dd9031990e2009c552b573ec72422170b54c9c0d91",
      "size": 14655
    },
    {
      "path": "reports/description_optimization_suite.md",
      "sha256": "5433f290fcc602fe33f07fbf2bf767c2f957c445741be5d27d997119b9bf9558",
      "size": 1170
    },
    {
      "path": "reports/eval_suite.json",
      "sha256": "be9edd5a4644c57d4830d9bf258cd2f9ee9b67c079c43eae5c227ffd3539cf83",
      "size": 130101
    },
    {
      "path": "reports/evidence_consistency.json",
      "sha256": "7fcd5c05a410b6dfb5eb5cddd1b1448847637ac1bacdba8e8eb41e5ca5a3142e",
      "size": 152696
    },
    {
      "path": "reports/evidence_consistency.md",
      "sha256": "2b119f2b9fa539a6f3e5434db02dccb6328a87d9ced6a29a6507892c7cea5a74",
      "size": 12886
    },
    {
      "path": "reports/family_summary.md",
      "sha256": "e783c704c610e6ea0b895fe8b8b793909efde92192c4def5032887209251a47c",
      "size": 1294
    },
    {
      "path": "reports/github-benchmark-scan.json",
      "sha256": "58970f8fc039c1ad3e17322b0132cc9b23c177c0293104ca039da6a9ec729031",
      "size": 12196
    },
    {
      "path": "reports/github-benchmark-scan.md",
      "sha256": "97fec05abbfe98098a10a31f8f60f9490a16e380411a323d86a8deaaad3b19e6",
      "size": 8637
    },
    {
      "path": "reports/governance_score.json",
      "sha256": "16d63c826cbbfa4b634e356fae56cedc806c957bc03c241f60779234361f0ba7",
      "size": 701
    },
    {
      "path": "reports/install_simulation.json",
      "sha256": "8def0abf208a4eb55b5c78af9b1a233e6fabb4724a583de32141cf79afecf953",
      "size": 8793
    },
    {
      "path": "reports/install_simulation.md",
      "sha256": "e324a099130a6f8ac88bfc6794d9c48e99fe00dc55de835e1c98f11cd4e38472",
      "size": 5534
    },
    {
      "path": "reports/intent-confidence.json",
      "sha256": "6003fe737277d8604b84ecaf2605c5f04b37d28341bec22e8bdc8b812f76b6f8",
      "size": 5147
    },
    {
      "path": "reports/intent-confidence.md",
      "sha256": "32931fd97edf8037d5548e13df1298905e656f74b4fe70f659604a18b9130727",
      "size": 1692
    },
    {
      "path": "reports/intent-context.json",
      "sha256": "e489bd574940a10e9d666abec30296472bb6fc13c97c9e9cbfae6bd486f618be",
      "size": 3389
    },
    {
      "path": "reports/intent-dialogue.json",
      "sha256": "621482f31adf3b3c931104f8c541e9e235fa8a129372949410dd27f3d40e6cda",
      "size": 5496
    },
    {
      "path": "reports/intent-dialogue.md",